{"diagnostic_report_id":"diag_fixture","version_number":1,"source_version_id":"sv_fixture","ir_revision_id":"ir_fixture","core_selling_points":["身份逆袭"],"target_audience":{"primary":"女性成长用户"},"emotional_value":["爽感"],"protagonist_curve":{"goal":"查明真相","resistance":"权势阻挠","cost":"失去信任","growth":"被动到主动"},"hook_recommendations":{"opening_3_seconds":"暗箭命中","first_30_seconds":"亮出账册","episode_end":"门外三声"},"nodes":[{"node_type":"反转","ordinal":1,"title":"账册现身","intensity":0.8,"production_complexity":0.3,"evidence":{"source_span_id":"span_fixture"}}]}
